{
  "login": "AndreyVSytoss",
  "id": 13361572,
  "avatar_url": "https://avatars1.githubusercontent.com/u/13361572?v=3",
  "gravatar_id": "",
  "url": "https://api.github.com/users/AndreyVSytoss",
  "html_url": "https://github.com/AndreyVSytoss",
  "followers_url": "https://api.github.com/users/AndreyVSytoss/followers",
  "following_url": "https://api.github.com/users/AndreyVSytoss/following{/other_user}",
  "gists_url": "https://api.github.com/users/AndreyVSytoss/gists{/gist_id}",
  "starred_url": "https://api.github.com/users/AndreyVSytoss/starred{/owner}{/repo}",
  "subscriptions_url": "https://api.github.com/users/AndreyVSytoss/subscriptions",
  "organizations_url": "https://api.github.com/users/AndreyVSytoss/orgs",
  "repos_url": "https://api.github.com/users/AndreyVSytoss/repos",
  "events_url": "https://api.github.com/users/AndreyVSytoss/events{/privacy}",
  "received_events_url": "https://api.github.com/users/AndreyVSytoss/received_events",
  "type": "User",
  "site_admin": false,
  "name": null,
  "company": null,
  "blog": null,
  "location": null,
  "email": null,
  "hireable": null,
  "bio": null,
  "public_repos": 7,
  "public_gists": 0,
  "followers": 1,
  "following": 0,
  "created_at": "2015-07-16T07:08:51Z",
  "updated_at": "2017-03-22T13:29:39Z"
}
